{
  "version": "7.3",
  "data_api_version": "3.0",
  "routing_model": {
    "OWNER": [
      "STORE"
    ],
    "STORE": [
      "LOCATION_DELIVERY"
    ],
    "LOCATION_DELIVERY": [
      "PLAN_LOGO"
    ],
    "PLAN_LOGO": [
      "COVER"
    ],
    "COVER": [
      "TIN"
    ],
    "TIN": [
      "REVIEW"
    ],
    "REVIEW": []
  },
  "screens": [
    {
      "id": "OWNER",
      "title": "Owner details",
      "data": {
        "first_name": {
          "type": "string",
          "__example__": ""
        },
        "surname": {
          "type": "string",
          "__example__": ""
        },
        "email": {
          "type": "string",
          "__example__": ""
        }
      },
      "refresh_on_back": true,
      "sensitive": [
        "first_name",
        "surname",
        "email"
      ],
      "layout": {
        "type": "SingleColumnLayout",
        "children": [
          {
            "type": "TextArea",
            "name": "first_name",
            "label": "First name",
            "required": true,
            "init-value": "${data.first_name}",
            "helper-text": "up to 100 characters."
          },
          {
            "type": "TextArea",
            "name": "surname",
            "label": "Surname",
            "required": true,
            "init-value": "${data.surname}",
            "helper-text": "up to 100 characters."
          },
          {
            "type": "TextArea",
            "name": "email",
            "label": "Email",
            "required": true,
            "init-value": "${data.email}",
            "helper-text": "Valid email; up to 100 characters."
          },
          {
            "type": "Footer",
            "label": "Continue",
            "on-click-action": {
              "name": "data_exchange",
              "payload": {
                "first_name": "${form.first_name}",
                "surname": "${form.surname}",
                "email": "${form.email}"
              }
            }
          }
        ]
      }
    },
    {
      "id": "STORE",
      "title": "Store details",
      "data": {
        "store_name": {
          "type": "string",
          "__example__": ""
        },
        "module_id": {
          "type": "string",
          "__example__": ""
        },
        "address": {
          "type": "string",
          "__example__": ""
        },
        "modules": {
          "type": "array",
          "items": {
            "type": "object",
            "properties": {
              "id": {
                "type": "string"
              },
              "title": {
                "type": "string"
              },
              "enabled": {
                "type": "boolean"
              }
            }
          },
          "__example__": [
            {
              "id": "example",
              "title": "Example",
              "enabled": true
            }
          ]
        }
      },
      "refresh_on_back": true,
      "sensitive": [
        "store_name",
        "module_id",
        "address"
      ],
      "layout": {
        "type": "SingleColumnLayout",
        "children": [
          {
            "type": "TextArea",
            "name": "store_name",
            "label": "Store name",
            "required": true,
            "init-value": "${data.store_name}",
            "helper-text": "up to 250 characters."
          },
          {
            "type": "Dropdown",
            "name": "module_id",
            "label": "Business module",
            "data-source": "${data.modules}",
            "required": true,
            "init-value": "${data.module_id}"
          },
          {
            "type": "TextArea",
            "name": "address",
            "label": "Store address",
            "required": true,
            "init-value": "${data.address}",
            "helper-text": "up to 500 characters."
          },
          {
            "type": "Footer",
            "label": "Continue",
            "on-click-action": {
              "name": "data_exchange",
              "payload": {
                "store_name": "${form.store_name}",
                "module_id": "${form.module_id}",
                "address": "${form.address}"
              }
            }
          }
        ]
      }
    },
    {
      "id": "LOCATION_DELIVERY",
      "title": "Location and delivery",
      "data": {
        "latitude": {
          "type": "string",
          "__example__": ""
        },
        "longitude": {
          "type": "string",
          "__example__": ""
        },
        "zone_id": {
          "type": "string",
          "__example__": ""
        },
        "minimum_delivery_time": {
          "type": "string",
          "__example__": ""
        },
        "maximum_delivery_time": {
          "type": "string",
          "__example__": ""
        },
        "delivery_time_unit": {
          "type": "string",
          "__example__": ""
        },
        "pickup_zone_ids": {
          "type": "array",
          "items": {
            "type": "string"
          },
          "__example__": []
        },
        "zones": {
          "type": "array",
          "items": {
            "type": "object",
            "properties": {
              "id": {
                "type": "string"
              },
              "title": {
                "type": "string"
              },
              "enabled": {
                "type": "boolean"
              }
            }
          },
          "__example__": [
            {
              "id": "example",
              "title": "Example",
              "enabled": true
            }
          ]
        },
        "pickup_zones": {
          "type": "array",
          "items": {
            "type": "object",
            "properties": {
              "id": {
                "type": "string"
              },
              "title": {
                "type": "string"
              },
              "enabled": {
                "type": "boolean"
              }
            }
          },
          "__example__": [
            {
              "id": "example",
              "title": "Example",
              "enabled": true
            }
          ]
        },
        "is_rental": {
          "type": "boolean",
          "__example__": false
        }
      },
      "refresh_on_back": true,
      "sensitive": [
        "latitude",
        "longitude",
        "zone_id",
        "minimum_delivery_time",
        "maximum_delivery_time",
        "delivery_time_unit",
        "pickup_zone_ids"
      ],
      "layout": {
        "type": "SingleColumnLayout",
        "children": [
          {
            "type": "TextBody",
            "text": "Enter the store coordinates from your map. Latitude comes first; longitude comes second."
          },
          {
            "type": "TextInput",
            "name": "latitude",
            "label": "Latitude",
            "required": true,
            "init-value": "${data.latitude}",
            "helper-text": "From -90 to 90; decimals and minus signs allowed."
          },
          {
            "type": "TextInput",
            "name": "longitude",
            "label": "Longitude",
            "required": true,
            "init-value": "${data.longitude}",
            "helper-text": "From -180 to 180."
          },
          {
            "type": "Dropdown",
            "name": "zone_id",
            "label": "Operating zone",
            "data-source": "${data.zones}",
            "required": true,
            "init-value": "${data.zone_id}"
          },
          {
            "type": "TextInput",
            "name": "minimum_delivery_time",
            "label": "Minimum delivery",
            "required": true,
            "init-value": "${data.minimum_delivery_time}",
            "input-type": "number"
          },
          {
            "type": "TextInput",
            "name": "maximum_delivery_time",
            "label": "Maximum delivery",
            "required": true,
            "init-value": "${data.maximum_delivery_time}",
            "input-type": "number"
          },
          {
            "type": "Dropdown",
            "name": "delivery_time_unit",
            "label": "Delivery unit",
            "required": true,
            "init-value": "${data.delivery_time_unit}",
            "data-source": [
              {
                "id": "min",
                "title": "Minutes"
              },
              {
                "id": "hours",
                "title": "Hours"
              },
              {
                "id": "days",
                "title": "Days"
              }
            ]
          },
          {
            "type": "CheckboxGroup",
            "name": "pickup_zone_ids",
            "label": "Rental pickup zones",
            "data-source": "${data.pickup_zones}",
            "required": "${data.is_rental}",
            "visible": "${data.is_rental}",
            "init-value": "${data.pickup_zone_ids}"
          },
          {
            "type": "Footer",
            "label": "Continue",
            "on-click-action": {
              "name": "data_exchange",
              "payload": {
                "latitude": "${form.latitude}",
                "longitude": "${form.longitude}",
                "zone_id": "${form.zone_id}",
                "minimum_delivery_time": "${form.minimum_delivery_time}",
                "maximum_delivery_time": "${form.maximum_delivery_time}",
                "delivery_time_unit": "${form.delivery_time_unit}",
                "pickup_zone_ids": "${form.pickup_zone_ids}"
              }
            }
          }
        ]
      }
    },
    {
      "id": "PLAN_LOGO",
      "title": "Plan and logo",
      "data": {
        "business_plan": {
          "type": "string",
          "__example__": ""
        },
        "package_id": {
          "type": "string",
          "__example__": ""
        },
        "plans": {
          "type": "array",
          "items": {